#CODE;ENGLISH;FRENCH;GERMAN;;SPANISH;;;;;;;;;x
EVTNAME_empire_state;The Empire State;;;;;;;;;;;;;x
EVTDESC_empire_state;The Northeast has long been divided among feuding realms, only having worked together once to repel Leonidas at the Battle of Washington. A powerful ruler has united Hudsonia and Gotham to consolidate the pre-Event lands of New York, taking on its old name of The Empire State. This new realm is being recognized as a Northern rival to the Holy Columbian Confederacy, able to act as the Northeast's bulwark against all who may threaten it.;;;;;;;;;;;;;x
EVTOPTA_empire_state;Never again will New York be threatened.;;;;;;;;;;;;;x
EVTOPTB_empire_state;The Northeast stands strong!;;;;;;;;;;;;;x
EVTOPTC_empire_state;A new chapter has begun.;;;;;;;;;;;;;x
EVTOPTD_empire_state;These Northerners cannot be allowed to challenge us.;;;;;;;;;;;;;x
nys_emperor_male;Metropolitan Blood of the New Yorker;;;;;;;;;;;;;x
nys_emperor_female;Metropolitan Blood of the New Yorker;;;;;;;;;;;;;x
bloodline_desc_nys_emperor;This ruler founded the Empire State as a Northeast bulwark to rival the Holy Columbian Confederacy.;;;;;;;;;;;;;x